user_input,retrieved_contexts,response,reference,faithfulness,answer_relevancy,context_precision,context_recall
How was the error reduced from 317389767.34 to 179983507.878?,"[""Getting Started with Python Machine Learning\n[ 20 ]\nThe absolute value of the error is seldom of use in isolation. However, when \ncomparing two competing models, we can use their errors to judge which one of \nthem is better. Although our first model clearly is not the one we would use, it serves \na very important purpose in the workflow. We will use it as our baseline until we \nfind a better one. Whatever model we come up with in the future, we will compare it \nagainst the current baseline.\nTowards some advanced stuff\nLet's now fit a more complex model, a polynomial of degree 2, to see whether it \nbetter understands our data:\n>>> f2p = sp.polyfit(x, y, 2)\n>>> print(f2p)\narray([  1.05322215e-02,  -5.26545650e+00,   1.97476082e+03])\n>>> f2 = sp.poly1d(f2p)\n>>> print(error(f2, x, y))\n179983507.878\nYou will get the following plot:"", ""[ 21 ]\nThe error is 179,983,507.878, which is almost half the error of the straight line model. \nThis is good but unfortunately this comes with a price: We now have a more complex \nfunction, meaning that we have one parameter more to tune inside \npolyfit(). The \nfitted polynomial is as follows:\nf(x) = 0.0105322215 * x**2  - 5.26545650 * x + 1974.76082\nSo, if more complexity gives better results, why not increase the complexity even \nmore? Let's try it for degrees 3, 10, and 100.\nInterestingly, we do not see d=53 for the polynomial that had been fitted with  \n100 degrees. Instead, we see lots of warnings on the console:\nRankWarning: Polyfit may be poorly conditioned\nThis means because of numerical errors, polyfit cannot determine a good fit with  \n100 degrees. Instead, it figured that 53 must be good enough."", 'fitting process. Of this, only residuals are of interest, which is exactly the error of  \nthe approximation:\n>>> print(""Model parameters: %s"" % fp1)\nModel parameters: [   2.59619213  989.02487106]\n>>> print(residuals)\n[  3.17389767e+08]\nThis means the best straight line fit is the following function\nf(x) = 2.59619213 * x + 989.02487106.\nWe then use poly1d() to create a model function from the model parameters:\n>>> f1 = sp.poly1d(fp1)\n>>> print(error(f1, x, y))\n317389767.34', 'percent of all transactions included 1,269, this gives us a lift of 255.\nThe need to have a decent number of transactions in these counts in order to be  \nable to make relatively solid inferences is why we must first select frequent itemsets. \nIf we were to generate rules from an infrequent itemset, the counts would be very \nsmall; due to this, the relative values would be meaningless (or subject to very large \nerror bars).\nNote that there are many more association rules discovered from this dataset: the \nalgorithm discovers 1,030 rules (requiring support for the baskets of at least 80 and \na minimum lift of 5). This is still a small dataset when compared to what is now \npossible with the web. With datasets containing millions of transactions, you can \nexpect to generate many thousands of rules, even millions.\nHowever, for each customer or each product, only a few rules will be relevant at any \ngiven time. So each costumer only receives a small number of recommendations.\nMore advanced basket analysis\nThere are now other algorithms for basket analysis that run faster than Apriori. The \ncode we saw earlier was simple and it was good enough for us, as we only had circa', ""Chapter 7\n[ 161 ]\nThis measure is also called the R² score. If you are using linear regression and \nevaluating the error on the training data, then it does correspond to the square  \nof the correlation coefficient, R. However, this measure is more general, and as  \nwe discussed, may even return a negative value.\nAn alternative way to compute the coefficient of determination is to use the score \nmethod of the LinearRegression object:\n>>> r2 = lr.score(x,y)\nMultidimensional regression\nSo far, we have only used a single variable for prediction, the number of \nrooms per dwelling. We will now use all the data we have to fit a model, using \nmultidimensional regression. We now try to predict a single output (the average \nhouse price) based on multiple inputs.\nThe code looks very much like before. In fact, it's even simpler as we can now pass \nthe value of \nboston.data directly to the fit method:\n>>> x = boston.data\n>>> y = boston.target\n>>> lr.fit(x, y)\nUsing all the input variables, the root mean squared error is only 4.7, which \ncorresponds to a coefficient of determination of 0.74. This is better than what we"", '[ 39 ]\nWe have now generated several models instead of just one. So, ""What final model \ndo we return and use for new data?"" The simplest solution is now to train a single \noverall model on all your training data. The cross-validation loop gives you an \nestimate of how well this model should generalize.\nA cross-validation schedule allows you to use all your data \nto estimate whether your methods are doing well. At the end \nof the cross-validation loop, you can then use all your data to \ntrain a final model.\nAlthough it was not properly recognized when machine learning was starting out as \na field, nowadays, it is seen as a very bad sign to even discuss the training accuracy \nof a classification system. This is because the results can be very misleading and even \njust presenting them marks you as a newbie in machine learning. We always want \nto measure and compare either the error on a held-out dataset or the error estimated \nusing a cross-validation scheme.\nBuilding more complex classifiers\nIn the previous section, we used a very simple model: a threshold on a single feature. \nAre there other types of systems? Yes, of course! Many others. Throughout this', ""Using Lasso or ElasticNet in scikit-learn\nLet's adapt the preceding example to use ElasticNets. Using scikit-learn, it is very \neasy to swap in the ElasticNet regressor for the least squares one that we had before:\n>>> from sklearn.linear_model import ElasticNet, Lasso\n>>> en = ElasticNet(alpha=0.5)\nNow, we use en, whereas earlier we had used lr. This is the only change that is \nneeded. The results are exactly what we would have expected. The training error \nincreases to 5.0 (it was 4.6 before), but the cross-validation error decreases to 5.4 (it \nwas 5.6 before). We trade a larger error on the training data in order to gain better \ngeneralization. We could have tried an L1 penalty using the \nLasso class or L2 using \nthe Ridge class with the same code."", 'Classification – Detecting Poor Answers\n[ 110 ]\nLooking at the graph, we immediately see that adding more training data will  \nnot help, as the dashed line corresponding to the test error seems to stay above 0.4. \nThe only option we have is to decrease the complexity, either by increasing k or by \nreducing the feature space.\nReducing the feature space does not help here. We can easily confirm this by plotting \nthe graph for a simplified feature space of only \nLinkCount and NumTextTokens:\nWe get similar graphs for other smaller feature sets. No matter what subset of \nfeatures we take, the graph would look similar.\nAt least reducing the model complexity by increasing k shows some positive impact:\nk mean(scores) stddev(scores)\n40 0.62800 0.03750\n10 0.62000 0.04111\n5 0.61400 0.02154']","The error was reduced from 317,389,767.34 to 179,983,507.878 by using a more complex model than the initial straight line model. The initial model was a straight line fit, which resulted in the higher error. By fitting a polynomial model instead, which is more complex, the error decreased significantly. The fitted polynomial function was of the form:

f(x) = 0.0105322215 * x**2 - 5.26545650 * x + 1974.76082.

This more complex polynomial model provided a better fit to the data, resulting in a lower error.","The error was reduced from 317,389,767.34 to 179,983,507.878 by using a polynomial model of degree 2 instead of a straight line (degree 1). Using sp.polyfit(x, y, 1) gives a straight line with error 317,389,767.34, while sp.polyfit(x, y, 2) fits a parabola with error 179,983,507.878, which is almost half the error of the straight line model.",1.0,0.12568264932174245,0.99999999995,1.0
Why is polyfit() used when fitting a straight line to web traffic data?,"['model is assumed to take a vector and return the results again as a vector of the same \nsize so that we can use it to calculate the difference to y.\nStarting with a simple straight line\nLet\'s assume for a second that the underlying model is a straight line. Then the \nchallenge is how to best put that line into the chart so that it results in the smallest \napproximation error. SciPy\'s \npolyfit() function does exactly that. Given data x and \ny and the desired order of the polynomial (a straight line has order 1), it finds the \nmodel function that minimizes the error function defined earlier:\nfp1, residuals, rank, sv, rcond = sp.polyfit(x, y, 1, full=True)\nThe polyfit() function returns the parameters of the fitted model function, fp1. \nAnd by setting full=True, we also get additional background information on the \nfitting process. Of this, only residuals are of interest, which is exactly the error of  \nthe approximation:\n>>> print(""Model parameters: %s"" % fp1)\nModel parameters: [   2.59619213  989.02487106]\n>>> print(residuals)\n[  3.17389767e+08]\nThis means the best straight line fit is the following function\nf(x) = 2.59619213 * x + 989.02487106.', ""[ 21 ]\nThe error is 179,983,507.878, which is almost half the error of the straight line model. \nThis is good but unfortunately this comes with a price: We now have a more complex \nfunction, meaning that we have one parameter more to tune inside \npolyfit(). The \nfitted polynomial is as follows:\nf(x) = 0.0105322215 * x**2  - 5.26545650 * x + 1974.76082\nSo, if more complexity gives better results, why not increase the complexity even \nmore? Let's try it for degrees 3, 10, and 100.\nInterestingly, we do not see d=53 for the polynomial that had been fitted with  \n100 degrees. Instead, we see lots of warnings on the console:\nRankWarning: Polyfit may be poorly conditioned\nThis means because of numerical errors, polyfit cannot determine a good fit with  \n100 degrees. Instead, it figured that 53 must be good enough."", 'fitting process. Of this, only residuals are of interest, which is exactly the error of  \nthe approximation:\n>>> print(""Model parameters: %s"" % fp1)\nModel parameters: [   2.59619213  989.02487106]\n>>> print(residuals)\n[  3.17389767e+08]\nThis means the best straight line fit is the following function\nf(x) = 2.59619213 * x + 989.02487106.\nWe then use poly1d() to create a model function from the model parameters:\n>>> f1 = sp.poly1d(fp1)\n>>> print(error(f1, x, y))\n317389767.34', '[ 19 ]\nWe have used full=True to retrieve more details on the fitting process. Normally, \nwe would not need it, in which case only the model parameters would be returned.\nWe can now use f1() to plot our first trained model. In addition to the preceding \nplotting instructions, we simply add the following code:\nfx = sp.linspace(0,x[-1], 1000) # generate X-values for plotting\nplt.plot(fx, f1(fx), linewidth=4)\nplt.legend([""d=%i"" % f1.order], loc=""upper left"")\nThis will produce the following plot:\nIt seems like the first 4 weeks are not that far off, although we clearly see that there is \nsomething wrong with our initial assumption that the underlying model is a straight \nline. And then, how good or how bad actually is the error of 317,389,767.34?', ""here, but it will surely take longer than making informed decisions. Let's take the \ninformed route, for which we need to introduce the bias-variance tradeoff.\nBias-variance and their tradeoff\nIn Chapter 1, Getting Started with Python Machine Learning, we tried to fit polynomials \nof different complexities controlled by the dimensionality parameter d to fit the \ndata. We realized that a two-dimensional polynomial, a straight line, does not fit the \nexample data very well, because the data was not of linear nature. No matter how \nelaborate our fitting procedure would have been, our two-dimensional model would \nsee everything as a straight line. We say that it is too biased for the data at hand. It is \nunder-fitting.\nWe played a bit with the dimensions and found out that the 100-dimensional \npolynomial is actually fitting very well to the data on which it was trained (we did \nnot know about train-test splits at that time). However, we quickly found out that it \nwas fitting too well. We realized that it was over-fitting so badly, that with different \nsamples of the data points, we would have gotten totally different 100-dimensional"", ""Getting Started with Python Machine Learning\n[ 24 ]\nAsked differently, why do we trust the straight line fitted only at the last week of our \ndata more than any of the more complex models? It is because we assume that it will \ncapture future data better. If we plot the models into the future, we see how right we \nare (d=1 is again our initial straight line).\nThe models of degree 10 and 53 don't seem to expect a bright future of our  \nstart-up. They tried so hard to model the given data correctly that they are clearly \nuseless to extrapolate beyond. This is called overfitting. On the other hand, the  \nlower degree models seem not to be capable of capturing the data good enough.  \nThis is called underfitting."", ""Getting Started with Python Machine Learning\n[ 18 ]\nBefore building our first model…\nWhen we talk about models, you can think of them as simplified theoretical \napproximations of complex reality. As such there is always some inferiority \ninvolved, also called the approximation error. This error will guide us in choosing \nthe right model among the myriad of choices we have. And this error will be \ncalculated as the squared distance of the model's prediction to the real data; for \nexample, for a learned model function \nf, the error is calculated as follows:\ndef error(f, x, y):\n    return sp.sum((f(x)-y)**2)\nThe vectors x and y contain the web stats data that we have extracted earlier. It is  \nthe beauty of SciPy's vectorized functions that we exploit here with f(x). The trained \nmodel is assumed to take a vector and return the results again as a vector of the same \nsize so that we can use it to calculate the difference to y.\nStarting with a simple straight line\nLet's assume for a second that the underlying model is a straight line. Then the \nchallenge is how to best put that line into the chart so that it results in the smallest \napproximation error. SciPy's"", 'Getting Started with Python Machine Learning\n[ 14 ]\nReading in the data\nWe have collected the web stats for the last month and aggregated them in ch01/\ndata/web_traffic.tsv (.tsv because it contains tab-separated values). They are \nstored as the number of hits per hour. Each line contains the hour consecutively and \nthe number of web hits in that hour.\nThe first few lines look like the following:\nUsing SciPy\'s genfromtxt(), we can easily read in the data using the following code:\n>>> import scipy as sp\n>>> data = sp.genfromtxt(""web_traffic.tsv"", delimiter=""\\t"")\nWe have to specify tab as the delimiter so that the columns are correctly determined.']","The `polyfit()` function is used when fitting a straight line to web traffic data because it finds the model function that minimizes the approximation error between the predicted values and the actual data. Specifically, for a straight line, which is a first-order polynomial (order 1), `polyfit()` calculates the best-fitting line by determining the parameters that result in the smallest squared distance (error) from the actual data points. This process allows for an optimal linear approximation of the web traffic data, making it easier to analyze trends and make predictions based on the fitted model.","polyfit() is used because it finds the best coefficients of a polynomial that minimize the residual error. For a straight line (order 1), polyfit(x, y, 1) returns two coefficients representing y = 2596.19x + 109532.17. The error function used inside polyfit is the residual of the fitted polynomial: error = sum((y' - y)^2), and polyfit finds the coefficients such that this error function is minimized.",0.75,0.9876644911115366,,0.6666666666666666
How are NaN values removed before plotting web traffic data?,"[""the Web hits in that particular hour. This splitting is done using the special index \nnotation of SciPy, by which we can choose the columns individually:\nx = data[:,0]\ny = data[:,1]\nThere are many more ways in which data can be selected from a SciPy array.  \nCheck out http://www.scipy.org/Tentative_NumPy_Tutorial for more  \ndetails on indexing, slicing, and iterating.\nOne caveat is still that we have some values in y that contain invalid values, nan. The \nquestion is what we can do with them. Let's check how many hours contain invalid \ndata, by running the following code:\n>>> sp.sum(sp.isnan(y))\n8"", 'Getting Started with Python Machine Learning\n[ 16 ]\nAs you can see, we are missing only 8 out of 743 entries, so we can afford to remove \nthem. Remember that we can index a SciPy array with another array. Sp.isnan(y) \nreturns an array of Booleans indicating whether an entry is a number or not. Using \n~, we logically negate that array so that we choose only those elements from x and y \nwhere y contains valid numbers:\n>>> x = x[~sp.isnan(y)]\n>>> y = y[~sp.isnan(y)]\nTo get the first impression of our data, let\'s plot the data in a scatter plot using \nmatplotlib. matplotlib contains the pyplot package, which tries to mimic MATLAB\'s \ninterface, which is a very convenient and easy to use one as you can see in the \nfollowing code:\n>>> import matplotlib.pyplot as plt\n>>> # plot the (x,y) points with dots of size 10\n>>> plt.scatter(x, y, s=10)\n>>> plt.title(""Web traffic over the last month"")\n>>> plt.xlabel(""Time"")\n>>> plt.ylabel(""Hits/hour"")\n>>> plt.xticks([w*7*24 for w in range(10)],\n               [\'week %i\' % w for w in range(10)])\n>>> plt.autoscale(tight=True)\n>>> # draw a slightly opaque, dashed grid\n>>> plt.grid(True, linestyle=\'-\', color=\'0.75\')\n>>> plt.show()', '>>> plt.scatter(x, y, s=10)\n>>> plt.title(""Web traffic over the last month"")\n>>> plt.xlabel(""Time"")\n>>> plt.ylabel(""Hits/hour"")\n>>> plt.xticks([w*7*24 for w in range(10)],\n               [\'week %i\' % w for w in range(10)])\n>>> plt.autoscale(tight=True)\n>>> # draw a slightly opaque, dashed grid\n>>> plt.grid(True, linestyle=\'-\', color=\'0.75\')\n>>> plt.show()\nYou can find more tutorials on plotting at http://matplotlib.org/\nusers/pyplot_tutorial.html.', 'Getting Started with Python Machine Learning\n[ 14 ]\nReading in the data\nWe have collected the web stats for the last month and aggregated them in ch01/\ndata/web_traffic.tsv (.tsv because it contains tab-separated values). They are \nstored as the number of hits per hour. Each line contains the hour consecutively and \nthe number of web hits in that hour.\nThe first few lines look like the following:\nUsing SciPy\'s genfromtxt(), we can easily read in the data using the following code:\n>>> import scipy as sp\n>>> data = sp.genfromtxt(""web_traffic.tsv"", delimiter=""\\t"")\nWe have to specify tab as the delimiter so that the columns are correctly determined.', '[ 15 ]\nA quick check shows that we have correctly read in the data:\n>>> print(data[:10])\n[[  1.00000000e+00   2.27200000e+03]\n [  2.00000000e+00              nan]\n [  3.00000000e+00   1.38600000e+03]\n [  4.00000000e+00   1.36500000e+03]\n [  5.00000000e+00   1.48800000e+03]\n [  6.00000000e+00   1.33700000e+03]\n [  7.00000000e+00   1.88300000e+03]\n [  8.00000000e+00   2.28300000e+03]\n [  9.00000000e+00   1.33500000e+03]\n [  1.00000000e+01   1.02500000e+03]]\n>>> print(data.shape)\n(743, 2)\nAs you can see, we have 743 data points with two dimensions.\nPreprocessing and cleaning the data\nIt is more convenient for SciPy to separate the dimensions into two vectors, each \nof size 743. The first vector, x, will contain the hours, and the other, y, will contain \nthe Web hits in that particular hour. This splitting is done using the special index \nnotation of SciPy, by which we can choose the columns individually:\nx = data[:,0]\ny = data[:,1]\nThere are many more ways in which data can be selected from a SciPy array.  \nCheck out http://www.scipy.org/Tentative_NumPy_Tutorial for more  \ndetails on indexing, slicing, and iterating.', 'Getting Started with Python Machine Learning\n[ 28 ]\nOf course, there is a certain uncertainty involved with our prediction. To get a real \npicture of it, one could draw in more sophisticated statistics to find out about the \nvariance we have to expect when looking farther and farther into the future.\nAnd then there are the user and underlying user behavior dynamics that we cannot \nmodel accurately. However, at this point, we are fine with the current predictions. \nAfter all, we can prepare all time-consuming actions now. If we then monitor our \nweb traffic closely, we will see in time when we have to allocate new resources.\nSummary\nCongratulations! You just learned two important things, of which the most \nimportant one is that as a typical machine learning operator, you will spend most of \nyour time in understanding and refining the data—exactly what we just did in our \nfirst tiny machine learning example. And we hope that this example helped you to \nstart switching your mental focus from algorithms to data. Then you learned how \nimportant it is to have the correct experiment setup and that it is vital to not mix up \ntraining and testing.', '[ 17 ]\nIn the resulting chart, we can see that while in the first weeks the traffic stayed more \nor less the same, the last week shows a steep increase:\nChoosing the right model and learning \nalgorithm\nNow that we have a first impression of the data, we return to the initial question: \nHow long will our server handle the incoming web traffic? To answer this we have \nto do the following:\n1. Find the real model behind the noisy data points.\n2. Following this, use the model to extrapolate into the future to find the point \nin time where our infrastructure has to be extended.', '[ 19 ]\nWe have used full=True to retrieve more details on the fitting process. Normally, \nwe would not need it, in which case only the model parameters would be returned.\nWe can now use f1() to plot our first trained model. In addition to the preceding \nplotting instructions, we simply add the following code:\nfx = sp.linspace(0,x[-1], 1000) # generate X-values for plotting\nplt.plot(fx, f1(fx), linewidth=4)\nplt.legend([""d=%i"" % f1.order], loc=""upper left"")\nThis will produce the following plot:\nIt seems like the first 4 weeks are not that far off, although we clearly see that there is \nsomething wrong with our initial assumption that the underlying model is a straight \nline. And then, how good or how bad actually is the error of 317,389,767.34?']","NaN values are removed from the web traffic data by using the `sp.isnan(y)` function, which returns an array of Booleans indicating whether each entry in `y` is a number or not. The logical negation of this array is then used to index both `x` and `y`, keeping only the elements where `y` contains valid numbers. The code used for this is:

```python
x = x[~sp.isnan(y)]
y = y[~sp.isnan(y)]
```

This effectively filters out the entries in `x` and `y` where `y` has NaN values, allowing for a clean dataset to be plotted.","NaN values are removed using NumPy's isnan() function combined with boolean indexing. First, sp.isnan(y) creates a boolean array marking invalid values. Then the negation operator ~ is used: x = x[~sp.isnan(y)] and y = y[~sp.isnan(y)]. This filters out all data points where y has invalid (NaN) values, keeping only valid entries.",1.0,0.9163882558160822,0.99999999995,1.0
Why does NumPy's array summation perform faster than Python loops?,"['print(""Normal Python: %f sec"" % normal_py_sec)\nprint(""Naive NumPy: %f sec"" % naive_np_sec)\nprint(""Good NumPy: %f sec"" % good_np_sec)\nNormal Python: 1.050749 sec\nNaive NumPy: 3.962259 sec\nGood NumPy: 0.040481 sec\nWe make two interesting observations. Firstly, by just using NumPy as data storage \n(Naive NumPy) takes 3.5 times longer, which is surprising since we believe it must \nbe much faster as it is written as a C extension. One reason for this is that the access \nof individual elements from Python itself is rather costly. Only when we are able \nto apply algorithms inside the optimized extension code is when we get speed \nimprovements. The other observation is quite a tremendous one: using the \ndot() \nfunction of NumPy, which does exactly the same, allows us to be more than 25 times \nfaster. In summary, in every algorithm we are about to implement, we should always \nlook how we can move loops over individual elements from Python to some of the \nhighly optimized NumPy or SciPy extension functions.', 'Getting Started with Python Machine Learning\n[ 12 ]\nHowever, the speed comes at a price. Using NumPy arrays, we no longer have the \nincredible flexibility of Python lists, which can hold basically anything. NumPy \narrays always have only one data type.\n>>> a = np.array([1,2,3])\n>>> a.dtype\ndtype(\'int64\')\nIf we try to use elements of different types, such as the ones shown in the following \ncode, NumPy will do its best to coerce them to be the most reasonable common  \ndata type:\n>>> np.array([1, ""stringy""])\narray([\'1\', \'stringy\'], dtype=\'<U7\')\n>>> np.array([1, ""stringy"", set([1,2,3])])\narray([1, stringy, {1, 2, 3}], dtype=object)\nLearning SciPy\nOn top of the efficient data structures of NumPy, SciPy offers a magnitude of \nalgorithms working on those arrays. Whatever numerical heavy algorithm you take \nfrom current books on numerical recipes, most likely you will find support for them \nin SciPy in one way or the other. Whether it is matrix manipulation, linear algebra, \noptimization, clustering, spatial operations, or even fast Fourier transformation, the \ntoolbox is readily filled. Therefore, it is a good habit to always inspect the \nscipy', 'Getting Started with Python Machine Learning\n[ 6 ]\nIntroduction to NumPy, SciPy, and matplotlib\nBefore we can talk about concrete machine learning algorithms, we have to talk \nabout how best to store the data we will chew through. This is important as the most \nadvanced learning algorithm will not be of any help to us if it will never finish. This \nmay be simply because accessing the data is too slow. Or maybe its representation \nforces the operating system to swap all day. Add to this that Python is an interpreted \nlanguage (a highly optimized one, though) that is slow for many numerically \nheavy algorithms compared to C or FORTRAN. So we might ask why on earth so \nmany scientists and companies are betting their fortune on Python even in highly \ncomputation-intensive areas?\nThe answer is that, in Python, it is very easy to off-load number crunching tasks to \nthe lower layer in the form of C or FORTRAN extensions. And that is exactly what \nNumPy and SciPy do (\nhttp://scipy.org/Download). In this tandem, NumPy \nprovides the support of highly optimized multidimensional arrays, which are the \nbasic data structure of most state-of-the-art algorithms. SciPy uses those arrays to', '[ 9 ]\nNote that here, c and a are totally independent copies.\nAnother big advantage of NumPy arrays is that the operations are propagated to the \nindividual elements. For example, multiplying a NumPy array will result in an array \nof the same size with all of its elements being multiplied:\n>>> d = np.array([1,2,3,4,5])\n>>> d*2\narray([ 2,  4,  6,  8, 10])\nSimilarly, for other operations:\n>>> d**2\narray([ 1,  4,  9, 16, 25])\nContrast that to ordinary Python lists:\n>>> [1,2,3,4,5]*2\n[1, 2, 3, 4, 5, 1, 2, 3, 4, 5]\n>>> [1,2,3,4,5]**2\nTraceback (most recent call last):\n  File ""<stdin>"", line 1, in <module>\nTypeError: unsupported operand type(s) for ** or pow(): \'list\' and \'int\'\nOf course by using NumPy arrays, we sacrifice the agility Python lists offer. Simple \noperations such as adding or removing are a bit complex for NumPy arrays. Luckily, \nwe have both at our hands and we will use the right one for the task at hand.\nIndexing\nPart of the power of NumPy comes from the versatile ways in which its arrays can  \nbe accessed.\nIn addition to normal list indexing, it allows you to use arrays themselves as indices \nby performing:\n>>> a[np.array([2,3,4])]\narray([77,  3,  4])', '[ 11 ]\nComparing the runtime\nLet\'s compare the runtime behavior of NumPy compared with normal Python lists. \nIn the following code, we will calculate the sum of all squared numbers from 1 to \n1000 and see how much time it will take. We perform it 10,000 times and report the \ntotal time so that our measurement is accurate enough.\nimport timeit\nnormal_py_sec = timeit.timeit(\'sum(x*x for x in range(1000))\',\n                              number=10000)\nnaive_np_sec = timeit.timeit(\n                \'sum(na*na)\',\n                setup=""import numpy as np; na=np.arange(1000)"",\n                number=10000)\ngood_np_sec = timeit.timeit(\n                \'na.dot(na)\',\n                setup=""import numpy as np; na=np.arange(1000)"",\n                number=10000)\nprint(""Normal Python: %f sec"" % normal_py_sec)\nprint(""Naive NumPy: %f sec"" % naive_np_sec)\nprint(""Good NumPy: %f sec"" % good_np_sec)\nNormal Python: 1.050749 sec\nNaive NumPy: 3.962259 sec\nGood NumPy: 0.040481 sec\nWe make two interesting observations. Firstly, by just using NumPy as data storage \n(Naive NumPy) takes 3.5 times longer, which is surprising since we believe it must', 'for each document, we can perform operations on its topic vector and forget about \nthe original words. If the topics are meaningful, they will be potentially more \ninformative than the raw words. Additionally, this may bring computational \nadvantages, as it is much faster to compare 100 vectors of topic weights than vectors \nof the size of the vocabulary (which will contain thousands of terms).\nUsing gensim, we have seen earlier how to compute the topics corresponding to all \nthe documents in the corpus. We will now compute these for all the documents and \nstore it in a NumPy arrays and compute all pairwise distances:\n>>> from gensim import matutils\n>>> topics = matutils.corpus2dense(model[corpus],  \n    num_terms=model.num_topics)\nNow, topics is a matrix of topics. We can use the pdist function in SciPy to \ncompute all pairwise distances. That is, with a single function call, we compute  \nall the values of sum((topics[ti] – topics[tj])**2):\n>>> from scipy.spatial import distance\n>>> pairwise = distance.squareform(distance.pdist(topics))\nNow, we will employ one last little trick; we will set the diagonal elements of the', 'the lower layer in the form of C or FORTRAN extensions. And that is exactly what \nNumPy and SciPy do (\nhttp://scipy.org/Download). In this tandem, NumPy \nprovides the support of highly optimized multidimensional arrays, which are the \nbasic data structure of most state-of-the-art algorithms. SciPy uses those arrays to \nprovide a set of fast numerical recipes. Finally, matplotlib (\nhttp://matplotlib.\norg/) is probably the most convenient and feature-rich library to plot high-quality \ngraphs using Python.\nInstalling Python\nLuckily, for all major operating systems, that is, Windows, Mac, and Linux, there \nare targeted installers for NumPy, SciPy, and matplotlib. If you are unsure about \nthe installation process, you might want to install Anaconda Python distribution \n(which you can access at \nhttps://store.continuum.io/cshop/anaconda/), which \nis driven by Travis Oliphant, a founding contributor of SciPy. What sets Anaconda \napart from other distributions such as Enthought Canopy (which you can download \nfrom \nhttps://www.enthought.com/downloads/) or Python(x,y) (accessible at \nhttp://code.google.com/p/pythonxy/wiki/Downloads), is that Anaconda is', ""Classification II – Sentiment Analysis\n[ 132 ]\nAccounting for arithmetic underflows\nThere is yet another road block. In reality, we work with probabilities much smaller \nthan the ones we have dealt with in the toy example. Typically, we also have many \nmore than only two features, which we multiply with each other. This will quickly \nlead to the point where the accuracy provided by NumPy does not suffice any more:\n>>> import numpy as np\n>>> np.set_printoptions(precision=20) # tell numpy to print out more  \ndigits (default is 8)\n>>> np.array([2.48E-324])\narray([ 4.94065645841246544177e-324])\n>>> np.array([2.47E-324])\narray([ 0.])\nSo, how probable is it that we will ever hit a number like 2.47E-324? To answer this, \nwe just need to imagine a likelihood for the conditional probabilities of 0.0001, and \nthen multiply 65 of them together (meaning that we have 65 low probable feature \nvalues) and you've been hit by the arithmetic underflow:\n>>> x = 0.00001\n>>> x**64 # still fine\n1e-320\n>>> x**65 # ouch\n0.0\nA float in Python is typically implemented using double in C. To find out whether \nthis is the case for your platform you can check it as follows:\n>>> import sys\n>>> sys.float_info""]","NumPy's array summation performs faster than Python loops primarily because NumPy is implemented as a C extension, which allows it to leverage highly optimized low-level operations. When using NumPy, operations are performed in bulk at the C level, which is significantly faster than iterating through elements in Python, where accessing individual elements is costly.

In the context provided, the comparison shows that using the `dot()` function of NumPy allows for a performance improvement of more than 25 times compared to naive Python summation methods. This speed advantage arises because NumPy can apply algorithms inside its optimized extension code, moving the computational workload away from Python's slower interpreted environment. 

In summary, the key reasons for the speed of NumPy's array summation are:
1. Bulk operations at the C level.
2. Reduced overhead from accessing individual elements in Python.
3. Utilization of optimized algorithms within NumPy's implementation.","NumPy's array operations are faster because NumPy delegates all its work to highly optimized C and Fortran code under the hood. For example, summing a NumPy array of 1,000,000 elements is about 67 times faster than using Python's built-in sum() on a normal list. This speed difference adds up significantly in machine learning workloads.",1.0,0.9957082555759877,,0.3333333333333333
What is overfitting and why is a degree 50 polynomial problematic?,"['Getting Started with Python Machine Learning\n[ 22 ]\nIt seems like the curves capture and better the fitted data the more complex they get. \nAnd also, the errors seem to tell the same story:\nError d=1: 317,389,767.339778\nError d=2: 179,983,507.878179\nError d=3: 139,350,144.031725\nError d=10: 121,942,326.363461\nError d=53: 109,318,004.475556\nHowever, taking a closer look at the fitted curves, we start to wonder whether they also \ncapture the true process that generated that data. Framed differently, do our models \ncorrectly represent the underlying mass behavior of customers visiting our website? \nLooking at the polynomial of degree 10 and 53, we see wildly oscillating behavior. It \nseems that the models are fitted too much to the data. So much that it is now capturing \nnot only the underlying process but also the noise. This is called overfitting.\nAt this point, we have the following choices:\n• Choosing one of the fitted polynomial models.\n• Switching to another more complex model class. Splines?\n• Thinking differently about the data and start again.\nOut of the five fitted models, the first order model clearly is too simple, and the', ""polynomial is actually fitting very well to the data on which it was trained (we did \nnot know about train-test splits at that time). However, we quickly found out that it \nwas fitting too well. We realized that it was over-fitting so badly, that with different \nsamples of the data points, we would have gotten totally different 100-dimensional \npolynomials. We say that the model has a too high variance for the given data, or \nthat it is over-fitting.\nThese are the extremes between which most of our machine learning problems \nreside. Ideally, we want to have both, low bias and low variance. But, we are in  \na bad world, and have to tradeoff between them. If we improve on one, we will \nlikely get worse on the other.\nFixing high bias\nLet's now assume we suffer from high bias. In that case, adding more training data \nclearly does not help. Also, removing features surely will not help, as our model \nwould have already been overly simplistic."", ""Getting Started with Python Machine Learning\n[ 24 ]\nAsked differently, why do we trust the straight line fitted only at the last week of our \ndata more than any of the more complex models? It is because we assume that it will \ncapture future data better. If we plot the models into the future, we see how right we \nare (d=1 is again our initial straight line).\nThe models of degree 10 and 53 don't seem to expect a bright future of our  \nstart-up. They tried so hard to model the given data correctly that they are clearly \nuseless to extrapolate beyond. This is called overfitting. On the other hand, the  \nlower degree models seem not to be capable of capturing the data good enough.  \nThis is called underfitting."", ""not only the underlying process but also the noise. This is called overfitting.\nAt this point, we have the following choices:\n• Choosing one of the fitted polynomial models.\n• Switching to another more complex model class. Splines?\n• Thinking differently about the data and start again.\nOut of the five fitted models, the first order model clearly is too simple, and the \nmodels of order 10 and 53 are clearly overfitting. Only the second and third order \nmodels seem to somehow match the data. However, if we extrapolate them at both \nborders, we see them going berserk.\nSwitching to a more complex class seems also not to be the right way to go. What \narguments would back which class? At this point, we realize that we probably have \nnot fully understood our data.\nStepping back to go forward – another look at our \ndata\nSo, we step back and take another look at the data. It seems that there is an inflection \npoint between weeks 3 and 4. So let's separate the data and train two lines using \nweek 3.5 as a separation point:\ninflection = 3.5*7*24 # calculate the inflection point in hours\nxa = x[:inflection] # data before the inflection point\nya = y[:inflection]"", ""[ 25 ]\nSo let's play fair to models of degree 2 and above and try out how they behave if we \nfit them only to the data of the last week. After all, we believe that the last week says \nmore about the future than the data prior to it. The result can be seen in the following \npsychedelic chart, which further shows how badly the problem of overfitting is.\nStill, judging from the errors of the models when trained only on the data from \nweek 3.5 and later, we still should choose the most complex one (note that we also \ncalculate the error only on the time after the inflection point):\nError d=1:   22,143,941.107618\nError d=2:   19,768,846.989176\nError d=3:   19,766,452.361027\nError d=10:  18,949,339.348539\nError d=53:  18,300,702.038119"", 'Regression\n[ 162 ]\nThe last line plots a diagonal line that corresponds to perfect agreement. This aids \nwith visualization. The results are shown in the following plot, where the solid line \nshows the diagonal (where all the points would lie if there was perfect agreement \nbetween the prediction and the underlying value):\nCross-validation for regression\nIf you remember when we first introduced classification, we stressed the importance \nof cross-validation for checking the quality of our predictions. In regression, this is \nnot always done. In fact, we discussed only the training error in this chapter so far. \nThis is a mistake if you want to confidently infer the generalization ability. Since \nordinary least squares is a very simple model, this is often not a very serious mistake. \nIn other words, the amount of overfitting is slight. However, we should still test this \nempirically, which we can easily do with scikit-learn.\nWe will use the \nKfold class to build a 5 fold cross-validation loop and test the \ngeneralization ability of linear regression:\n>>> from sklearn.cross_validation import Kfold\n>>> kf = KFold(len(x), n_folds=5)\n>>> p = np.zeros_like(y)\n>>> for train,test in kf:', ""[ 21 ]\nThe error is 179,983,507.878, which is almost half the error of the straight line model. \nThis is good but unfortunately this comes with a price: We now have a more complex \nfunction, meaning that we have one parameter more to tune inside \npolyfit(). The \nfitted polynomial is as follows:\nf(x) = 0.0105322215 * x**2  - 5.26545650 * x + 1974.76082\nSo, if more complexity gives better results, why not increase the complexity even \nmore? Let's try it for degrees 3, 10, and 100.\nInterestingly, we do not see d=53 for the polynomial that had been fitted with  \n100 degrees. Instead, we see lots of warnings on the console:\nRankWarning: Polyfit may be poorly conditioned\nThis means because of numerical errors, polyfit cannot determine a good fit with  \n100 degrees. Instead, it figured that 53 must be good enough."", 'confidence (we are looking at the test data to decide which parameter values to use \nand which we should never use). The next section explains how to do it properly and \nhow this is supported by scikit-learn.\nSetting hyperparameters in a principled way\nIn the preceding example, we set the penalty parameter to 0.1. We could just as well \nhave set it to 0.7 or 23.9. Naturally, the results vary each time. If we pick an overly \nlarge value, we get underfitting. In the extreme case, the learning system will just \nreturn every coefficient equal to zero. If we pick a value that is too small, we are very \nclose to OLS, which overfits and generalizes poorly (as we saw earlier).\nHow do we choose a good value? This is a general problem in machine  \nlearning: setting parameters for our learning methods. A generic solution is to use \ncross-validation. We pick a set of possible values, and then use cross-validation to \nchoose which one is best. This performs more computation (five times more if we  \nuse five folds), but is always applicable and unbiased.']","Overfitting occurs when a model is too complex and captures not only the underlying process that generated the data but also the noise present in the data. This results in a model that performs very well on the training data but poorly on unseen data, as it has essentially memorized the training data rather than learning the general patterns.

A degree 50 polynomial is problematic because it is likely to fit the training data too closely, leading to wildly oscillating behavior and high variance. Such a model may perform well on the training set but will struggle to generalize to new data, as it is overly sensitive to the specific data points it was trained on. This can result in very different predictions if the model is applied to different samples of data, indicating that it has overfitted the training data.","Overfitting occurs when a model is too complex and fits the training data too closely, capturing noise instead of the underlying pattern. A polynomial of degree 50 nicely passes through all data points from the past and has a low training error of 109,504,587.153, but it will most probably not provide good results for future requests. The model captures the noise in the data rather than the true underlying process.",1.0,0.9394890928290782,0.999999999975,1.0
What is the purpose of train/test split in machine learning?,"['Chapter 8\n[ 187 ]\nIn order to fit this combination model, we will split the training data into two. \nAlternatively, we could have used cross-validation (the original stacked learning \nmodel worked like this). However, in this case, we have enough data to obtain good \nestimates by leaving some aside.\nAs when fitting hyperparameters, though, we need two layers of training/testing \nsplits: a first, higher-level split, and then, inside the training split, a second split to  \nbe able to fit the stacked learner, as show in the following:\n>>> train,test = load_ml100k.get_train_test(random_state=12)\n>>> # Now split the training again into two subgroups\n>>> tr_train,tr_test = load_ml100k.get_train_test(train,  \n    random_state=34)\n>>> # Call all the methods we previously defined:\n>>> # these have been implemented as functions:\n>>> tr_predicted0 = regression.predict(tr_train)\n>>> tr_predicted1 = regression.predict(tr_train.T).T\n>>> tr_predicted2 = corrneighbours.predict(tr_train)\n>>> tr_predicted3 = corrneighbours.predict(tr_train.T).T\n>>> tr_predicted4 = norm.predict(tr_train)\n>>> tr_predicted5 = norm.predict(tr_train.T).T\n>>> # Now assemble these predictions into a single array:', 'True]\n[1 1 1 1 4 1 3 2 1 1]\n8 [ True  True  True  True False  True False  True  True  \nTrue]\n[1 1 1 1 3 1 2 1 1 1]\n9 [ True  True  True  True False  True  True  True  True  \nTrue]\n[1 1 1 1 2 1 1 1 1 1]\n10 [ True  True  True  True  True  True  True  True  True  \nTrue]\n[1 1 1 1 1 1 1 1 1 1]\nWe see that the result is very stable. Features that have been used when requesting \nsmaller feature sets keep on getting selected when letting more features in. At last, \nwe rely on our train/test set splitting to warn us when we go the wrong way.\nOther feature selection methods\nThere are several other feature selection methods that you will discover while \nreading through machine learning literature. Some even don\'t look like being a \nfeature selection method because they are embedded into the learning process (not \nto be confused with the aforementioned wrappers). Decision trees, for instance, have \na feature selection mechanism implanted deep in their core. Other learning methods \nemploy some kind of regularization that punishes model complexity, thus driving \nthe learning process towards good performing models that are still ""simple"". They do', 'Chapter 6\n[ 137 ]\n        proba = clf.predict_proba(X_test)\n        precision, recall, pr_thresholds =  \n        precision_recall_curve(y_test, proba[:,1])\n        pr_scores.append(auc(recall, precision))\n        summary = (np.mean(scores), np.std(scores),\nnp.mean(pr_scores), np.std(pr_scores))\n        print(""%.3f\\t%.3f\\t%.3f\\t%.3f"" % summary)\nPutting everything together, we can train our first model:\n>>> X, Y = load_sanders_data()\n>>> pos_neg_idx = np.logical_or(Y==""positive"", Y==""negative"")\n>>> X = X[pos_neg_idx]\n>>> Y = Y[pos_neg_idx]\n>>> Y = Y==""positive""\n>>> train_model(create_ngram_model, X, Y)\n0.788   0.024   0.882   0.036\nWith our first try using Naïve Bayes on vectorized TF-IDF trigram features, we get \nan accuracy of 78.8 percent and an average P/R AUC of 88.2 percent. Looking at the \nP/R chart of the median (the train/test split that is performing most similar to the \naverage), it shows a much more encouraging behavior than the plots we have seen in \nthe previous chapter.', 'Classification II – Sentiment Analysis\n[ 142 ]\nGridSearchCV expects the dictionary\'s keys to obey a certain format so that it is able \nto set the parameters of the correct estimator. The format is as follows:\n<estimator>__<subestimator>__...__<param_name>\nFor example, if we want to specify the desired values to explore for the min_df \nparameter of TfidfVectorizer (named vect in the Pipeline description), we \nwould have to say:\nparam_grid={""vect__ngram_range""=[(1, 1), (1, 2), (1, 3)]}\nThis will tell GridSearchCV to try out unigrams to trigrams as parameter values for \nthe ngram_range parameter of TfidfVectorizer.\nThen, it trains the estimator with all possible parameter value combinations. \nHere, we make sure that it trains on random samples of the training data using \nShuffleSplit, which generates an iterator of random train/test splits. Finally, it \nprovides the best estimator in the form of the member variable, best_estimator_.\nAs we want to compare the returned best classifier with our current best one, we \nneed to evaluate it in the same way. Therefore, we can pass the \nShuffleSplit \ninstance using the cv parameter (therefore, CV in GridSearchCV).', 'ShuffleSplit, which generates an iterator of random train/test splits. Finally, it \nprovides the best estimator in the form of the member variable, best_estimator_.\nAs we want to compare the returned best classifier with our current best one, we \nneed to evaluate it in the same way. Therefore, we can pass the \nShuffleSplit \ninstance using the cv parameter (therefore, CV in GridSearchCV).\nThe last missing piece is to define how GridSearchCV should determine the best \nestimator. This can be done by providing the desired score function to (surprise!) \nthe \nscore_func parameter. We can either write one ourselves, or pick one from the \nsklearn.metrics package. We should certainly not take metric.accuracy because \nof our class imbalance (we have a lot less tweets containing sentiment than neutral \nones). Instead, we want to have good precision and recall on both classes, tweets \nwith sentiment and tweets without positive or negative opinions. One metric that \ncombines both precision and recall is the so-called F-measure, which is implemented \nas \nmetrics.f1_score:\nAfter putting everything together, we get the following code:\nfrom sklearn.grid_search import GridSearchCV', 'Classification – Music Genre Classification\n[ 208 ]\nThis prints the distribution of labels that the classifier predicted for the test set  \nfor every genre. The diagonal represents the correct classifications. Since we have  \nsix genres, we have a six-by-six matrix. The first row in the matrix says that for  \n31 Classical songs (sum of first row), it predicted 26 to belong to the genre Classical, \n1 to be a Jazz song, 2 to belong to the Country genre, and 2 to be Metal songs. \nThe diagonal shows the correct classifications. In the first row, we see that out \nof (26+1+2+2)=31 songs, 26 have been correctly classified as classical and 5 were \nmisclassifications. This is actually not that bad. The second row is more sobering: \nonly 7 out of 24 Jazz songs have been correctly classified—that is, only 29 percent.\nOf course, we follow the train/test split setup from the previous chapters, so that we \nactually have to record the confusion matrices per cross-validation fold. We have to \naverage and normalize later on, so that we have a range between 0 (total failure) and \n1 (everything classified correctly).\nA graphical visualization is often much easier to read than NumPy arrays. The', 'very specific and none of the more general packages address it.\nSummary\nWe are now truly at the end. We hope you enjoyed the book and feel well equipped \nto start your own machine learning adventure.\nWe also hope you learned the importance of carefully testing your methods. In \nparticular, the importance of using correct cross-validation method and not report \ntraining test results, which are an over-inflated estimate of how good your method \nreally is.', ""To keep our experimentation agile, let's wrap everything together in a train_\nmodel()function, which takes a function as a parameter that creates the classifier.\nfrom sklearn.metrics import precision_recall_curve, auc\nfrom sklearn.cross_validation import ShuffleSplit\ndef train_model(clf_factory, X, Y):\n    # setting random_state to get deterministic behavior\n    cv = ShuffleSplit(n=len(X), n_iter=10, test_size=0.3,  \n    random_state=0)\n    scores = []\n    pr_scores = []\n    for train, test in cv:\n        X_train, y_train = X[train], Y[train]\n        X_test, y_test = X[test], Y[test]\n        clf = clf_factory()\n        clf.fit(X_train, y_train)\n        train_score = clf.score(X_train, y_train)\n        test_score = clf.score(X_test, y_test)\n        scores.append(test_score)""]","The purpose of train/test split in machine learning is to evaluate the performance of a model by dividing the dataset into two parts: a training set and a testing set. The training set is used to train the model, while the testing set is used to assess how well the model generalizes to unseen data. This helps to prevent overfitting, where a model performs well on the training data but poorly on new, unseen data. By using a separate test set, we can obtain a more accurate estimate of the model's performance in real-world scenarios.","The purpose of train/test split is to properly evaluate a model's performance on unseen data. If we measure the error of a model on the same data used for training, the error will be misleadingly low. By splitting data into training and test datasets, we can train the model on one portion and evaluate it on another. The training error is not a good indicator of how well the model performs on unseen data — the test error is more reliable.",1.0,1.0,0.4027777777643518,1.0
How is web traffic data read from a file using SciPy?,"['Getting Started with Python Machine Learning\n[ 14 ]\nReading in the data\nWe have collected the web stats for the last month and aggregated them in ch01/\ndata/web_traffic.tsv (.tsv because it contains tab-separated values). They are \nstored as the number of hits per hour. Each line contains the hour consecutively and \nthe number of web hits in that hour.\nThe first few lines look like the following:\nUsing SciPy\'s genfromtxt(), we can easily read in the data using the following code:\n>>> import scipy as sp\n>>> data = sp.genfromtxt(""web_traffic.tsv"", delimiter=""\\t"")\nWe have to specify tab as the delimiter so that the columns are correctly determined.', '[ 15 ]\nA quick check shows that we have correctly read in the data:\n>>> print(data[:10])\n[[  1.00000000e+00   2.27200000e+03]\n [  2.00000000e+00              nan]\n [  3.00000000e+00   1.38600000e+03]\n [  4.00000000e+00   1.36500000e+03]\n [  5.00000000e+00   1.48800000e+03]\n [  6.00000000e+00   1.33700000e+03]\n [  7.00000000e+00   1.88300000e+03]\n [  8.00000000e+00   2.28300000e+03]\n [  9.00000000e+00   1.33500000e+03]\n [  1.00000000e+01   1.02500000e+03]]\n>>> print(data.shape)\n(743, 2)\nAs you can see, we have 743 data points with two dimensions.\nPreprocessing and cleaning the data\nIt is more convenient for SciPy to separate the dimensions into two vectors, each \nof size 743. The first vector, x, will contain the hours, and the other, y, will contain \nthe Web hits in that particular hour. This splitting is done using the special index \nnotation of SciPy, by which we can choose the columns individually:\nx = data[:,0]\ny = data[:,1]\nThere are many more ways in which data can be selected from a SciPy array.  \nCheck out http://www.scipy.org/Tentative_NumPy_Tutorial for more  \ndetails on indexing, slicing, and iterating.', 'Getting Started with Python Machine Learning\n[ 16 ]\nAs you can see, we are missing only 8 out of 743 entries, so we can afford to remove \nthem. Remember that we can index a SciPy array with another array. Sp.isnan(y) \nreturns an array of Booleans indicating whether an entry is a number or not. Using \n~, we logically negate that array so that we choose only those elements from x and y \nwhere y contains valid numbers:\n>>> x = x[~sp.isnan(y)]\n>>> y = y[~sp.isnan(y)]\nTo get the first impression of our data, let\'s plot the data in a scatter plot using \nmatplotlib. matplotlib contains the pyplot package, which tries to mimic MATLAB\'s \ninterface, which is a very convenient and easy to use one as you can see in the \nfollowing code:\n>>> import matplotlib.pyplot as plt\n>>> # plot the (x,y) points with dots of size 10\n>>> plt.scatter(x, y, s=10)\n>>> plt.title(""Web traffic over the last month"")\n>>> plt.xlabel(""Time"")\n>>> plt.ylabel(""Hits/hour"")\n>>> plt.xticks([w*7*24 for w in range(10)],\n               [\'week %i\' % w for w in range(10)])\n>>> plt.autoscale(tight=True)\n>>> # draw a slightly opaque, dashed grid\n>>> plt.grid(True, linestyle=\'-\', color=\'0.75\')\n>>> plt.show()', 'for each sound file.\nimport os\nimport scipy\ndef create_fft(fn):\n    sample_rate, X = scipy.io.wavfile.read(fn)\n    fft_features = abs(scipy.fft(X)[:1000])\n    base_fn, ext = os.path.splitext(fn)\n    data_fn = base_fn + "".fft""\n    scipy.save(data_fn, fft_features)\nWe save the data using NumPy\'s save() function, which always appends .npy  \nto the filename. We only have to do this once for every WAV file needed for  \ntraining or predicting.\nThe corresponding FFT reading function is read_fft():\nimport glob\ndef read_fft(genre_list, base_dir=GENRE_DIR):\n    X = []\n    y = []\n    for label, genre in enumerate(genre_list):\n        genre_dir = os.path.join(base_dir, genre, ""*.fft.npy"")\n        file_list = glob.glob(genre_dir)\n        for fn in file_list:', ""[ 7 ]\nFor an in-depth explanation, you might want to take a look at some of the more \ninteresting examples of what NumPy has to offer at http://www.scipy.org/\nTentative_NumPy_Tutorial.\nYou will also find the NumPy Beginner's Guide - Second Edition, Ivan Idris, by  \nPackt Publishing, to be very valuable. Additional tutorial style guides can be  \nfound at http://scipy-lectures.github.com, and the official SciPy tutorial  \nat http://docs.scipy.org/doc/scipy/reference/tutorial.\nIn this book, we will use NumPy in version 1.8.1 and \nSciPy in version 0.14.0.\nLearning NumPy\nSo let's import NumPy and play a bit with it. For that, we need to start the Python \ninteractive shell:\n>>> import numpy\n>>> numpy.version.full_version\n1.8.1\nAs we do not want to pollute our namespace, we certainly should not use the \nfollowing code:\n>>> from numpy import *\nBecause, for instance, numpy.array will potentially shadow the array package that is \nincluded in standard Python. Instead, we will use the following convenient shortcut:\n>>> import numpy as np\n>>> a = np.array([0,1,2,3,4,5])\n>>> a\narray([0, 1, 2, 3, 4, 5])\n>>> a.ndim\n1\n>>> a.shape\n(6,)"", '[ i ]\nTable of Contents\nPreface vii\nChapter 1: Getting Started with Python Machine Learning 1\nMachine learning and Python – a dream team 2\nWhat the book will teach you (and what it will not) 3\nWhat to do when you are stuck 4\nGetting started 5\nIntroduction to NumPy, SciPy, and matplotlib 6\nInstalling Python 6\nChewing data efficiently with NumPy and intelligently with SciPy 6\nLearning NumPy 7\nIndexing 9\nHandling nonexisting values 10\nComparing the runtime 11\nLearning SciPy 12\nOur first (tiny) application of machine learning 13\nReading in the data 14\nPreprocessing and cleaning the data 15\nChoosing the right model and learning algorithm 17\nBefore building our first model… 18\nStarting with a simple straight line 18\nTowards some advanced stuff 20\nStepping back to go forward – another look at our data 22\nTraining and testing 26\nAnswering our initial question 27\nSummary 28\nChapter 2: Classifying with Real-world Examples 29\nThe Iris dataset 30\nVisualization is a good first step 30\nBuilding our first classification model 32\nEvaluation – holding out data and cross-validation 36', 'Chapter 9\n[ 201 ]\nX now contains the samples and sample_rate is the rate at which they were taken. \nLet us use that information to peek into some music files to get a first impression of \nwhat the data looks like.\nLooking at music\nA very convenient way to get a quick impression of what the songs of the diverse \ngenres ""look"" like is to draw a spectrogram for a set of songs of a genre. A \nspectrogram is a visual representation of the frequencies that occur in a song. It \nshows the intensity for the frequencies at the y axis in the specified time intervals at \nthe x axis. That is, the darker the color, the stronger the frequency is in the particular \ntime window of the song.\nMatplotlib provides the convenient function \nspecgram() that performs most of the \nunder-the-hood calculation and plotting for us:\n>>> import scipy\n>>> from matplotlib.pyplot import specgram\n>>> sample_rate, X = scipy.io.wavfile.read(wave_filename)\n>>> print sample_rate, X.shape\n22050, (661794,)\n>>> specgram(X, Fs=sample_rate, xextent=(0,30))\nThe WAV file we just read in was sampled at a rate of 22,050 Hz and  \ncontains 661,794 samples.', ""chapters: we take a certain fraction of our data points (we will use 10 percent) and \nreserve them for testing; the rest will be used for training. However, because the data \nis structured differently in this context, the code is different. The first step is to load \nthe data from disk, for which we use the following function:\ndef load():\n    import numpy as np\n    from scipy import sparse\n    data = np.loadtxt('data/ml-100k/u.data')\n    ij = data[:, :2]\n    ij -= 1  # original data is in 1-based system\n    values = data[:, 2]\n    reviews = sparse.csc_matrix((values, ij.T)).astype(float)\n    return reviews.toarray()\nNote that zero entries in this matrix represent missing ratings.\n>>> reviews = load()\n>>> U,M = np.where(reviews)\nWe now use the standard random module to choose indices to test:\n>>> import random\n>>> test_idxs = np.array(random.sample(range(len(U)), len(U)//10))""]","Web traffic data is read from a file using SciPy's `genfromtxt()` function. The data is stored in a tab-separated values (TSV) file named ""web_traffic.tsv"". The code to read the data is as follows:

```python
import scipy as sp
data = sp.genfromtxt(""web_traffic.tsv"", delimiter=""\t"")
```

In this code, the `delimiter` is specified as a tab (`\t`) to ensure that the columns are correctly determined. After reading the data, a quick check can be performed to confirm that it has been read correctly, for example by printing the first few lines or checking the shape of the data.","Web traffic data is read using SciPy's genfromtxt() function: data = sp.genfromtxt('web_traffic.tsv', delimiter='\t'). The file is tab-separated (.tsv). The data is then split into two arrays: x = data[:,0] for the hours and y = data[:,1] for the web hits. There are 8 hours out of 743 total that contain NaN (invalid) values which need to be cleaned before analysis.",1.0,1.0,0.99999999995,1.0
"What are the errors for polynomial degrees 3, 10, and 50 when fitting web traffic data?","[""[ 21 ]\nThe error is 179,983,507.878, which is almost half the error of the straight line model. \nThis is good but unfortunately this comes with a price: We now have a more complex \nfunction, meaning that we have one parameter more to tune inside \npolyfit(). The \nfitted polynomial is as follows:\nf(x) = 0.0105322215 * x**2  - 5.26545650 * x + 1974.76082\nSo, if more complexity gives better results, why not increase the complexity even \nmore? Let's try it for degrees 3, 10, and 100.\nInterestingly, we do not see d=53 for the polynomial that had been fitted with  \n100 degrees. Instead, we see lots of warnings on the console:\nRankWarning: Polyfit may be poorly conditioned\nThis means because of numerical errors, polyfit cannot determine a good fit with  \n100 degrees. Instead, it figured that 53 must be good enough."", 'Getting Started with Python Machine Learning\n[ 22 ]\nIt seems like the curves capture and better the fitted data the more complex they get. \nAnd also, the errors seem to tell the same story:\nError d=1: 317,389,767.339778\nError d=2: 179,983,507.878179\nError d=3: 139,350,144.031725\nError d=10: 121,942,326.363461\nError d=53: 109,318,004.475556\nHowever, taking a closer look at the fitted curves, we start to wonder whether they also \ncapture the true process that generated that data. Framed differently, do our models \ncorrectly represent the underlying mass behavior of customers visiting our website? \nLooking at the polynomial of degree 10 and 53, we see wildly oscillating behavior. It \nseems that the models are fitted too much to the data. So much that it is now capturing \nnot only the underlying process but also the noise. This is called overfitting.\nAt this point, we have the following choices:\n• Choosing one of the fitted polynomial models.\n• Switching to another more complex model class. Splines?\n• Thinking differently about the data and start again.\nOut of the five fitted models, the first order model clearly is too simple, and the', '[ 23 ]\nyb = y[inflection:]\nfa = sp.poly1d(sp.polyfit(xa, ya, 1))\nfb = sp.poly1d(sp.polyfit(xb, yb, 1))\nfa_error = error(fa, xa, ya)\nfb_error = error(fb, xb, yb)\nprint(""Error inflection=%f"" % (fa_error + fb_error))\nError inflection=132950348.197616\nFrom the first line, we train with the data up to week 3, and in the second line we \ntrain with the remaining data.\nClearly, the combination of these two lines seems to be a much better fit to the data \nthan anything we have modeled before. But still, the combined error is higher than \nthe higher order polynomials. Can we trust the error at the end?', ""Getting Started with Python Machine Learning\n[ 20 ]\nThe absolute value of the error is seldom of use in isolation. However, when \ncomparing two competing models, we can use their errors to judge which one of \nthem is better. Although our first model clearly is not the one we would use, it serves \na very important purpose in the workflow. We will use it as our baseline until we \nfind a better one. Whatever model we come up with in the future, we will compare it \nagainst the current baseline.\nTowards some advanced stuff\nLet's now fit a more complex model, a polynomial of degree 2, to see whether it \nbetter understands our data:\n>>> f2p = sp.polyfit(x, y, 2)\n>>> print(f2p)\narray([  1.05322215e-02,  -5.26545650e+00,   1.97476082e+03])\n>>> f2 = sp.poly1d(f2p)\n>>> print(error(f2, x, y))\n179983507.878\nYou will get the following plot:"", 'Clustering – Finding Related Posts\n[ 72 ]\nClustering posts\nYou would have already noticed one thing—real data is noisy. The newsgroup \ndataset is no exception. It even contains invalid characters that will result in \nUnicodeDecodeError.\nWe have to tell the vectorizer to ignore them:\n>>> vectorizer = StemmedTfidfVectorizer(min_df=10, max_df=0.5,\n...              stop_words=\'english\', decode_error=\'ignore\')\n>>> vectorized = vectorizer.fit_transform(train_data.data)\n>>> num_samples, num_features = vectorized.shape\n>>> print(""#samples: %d, #features: %d"" % (num_samples,  \nnum_features))\n#samples: 3529, #features: 4712\nWe now have a pool of 3,529 posts and extracted for each of them a feature vector  \nof 4,712 dimensions. That is what K-means takes as input. We will fix the cluster size \nto 50 for this chapter and hope you are curious enough to try out different values as \nan exercise.\n>>> num_clusters = 50\n>>> from sklearn.cluster import KMeans\n>>> km = KMeans(n_clusters=num_clusters, init=\'random\', n_init=1,\nverbose=1, random_state=3)\n>>> km.fit(vectorized)\nThat\'s it. We provided a random state just so that you can get the same results. In', ""not only the underlying process but also the noise. This is called overfitting.\nAt this point, we have the following choices:\n• Choosing one of the fitted polynomial models.\n• Switching to another more complex model class. Splines?\n• Thinking differently about the data and start again.\nOut of the five fitted models, the first order model clearly is too simple, and the \nmodels of order 10 and 53 are clearly overfitting. Only the second and third order \nmodels seem to somehow match the data. However, if we extrapolate them at both \nborders, we see them going berserk.\nSwitching to a more complex class seems also not to be the right way to go. What \narguments would back which class? At this point, we realize that we probably have \nnot fully understood our data.\nStepping back to go forward – another look at our \ndata\nSo, we step back and take another look at the data. It seems that there is an inflection \npoint between weeks 3 and 4. So let's separate the data and train two lines using \nweek 3.5 as a separation point:\ninflection = 3.5*7*24 # calculate the inflection point in hours\nxa = x[:inflection] # data before the inflection point\nya = y[:inflection]"", 'Getting Started with Python Machine Learning\n[ 16 ]\nAs you can see, we are missing only 8 out of 743 entries, so we can afford to remove \nthem. Remember that we can index a SciPy array with another array. Sp.isnan(y) \nreturns an array of Booleans indicating whether an entry is a number or not. Using \n~, we logically negate that array so that we choose only those elements from x and y \nwhere y contains valid numbers:\n>>> x = x[~sp.isnan(y)]\n>>> y = y[~sp.isnan(y)]\nTo get the first impression of our data, let\'s plot the data in a scatter plot using \nmatplotlib. matplotlib contains the pyplot package, which tries to mimic MATLAB\'s \ninterface, which is a very convenient and easy to use one as you can see in the \nfollowing code:\n>>> import matplotlib.pyplot as plt\n>>> # plot the (x,y) points with dots of size 10\n>>> plt.scatter(x, y, s=10)\n>>> plt.title(""Web traffic over the last month"")\n>>> plt.xlabel(""Time"")\n>>> plt.ylabel(""Hits/hour"")\n>>> plt.xticks([w*7*24 for w in range(10)],\n               [\'week %i\' % w for w in range(10)])\n>>> plt.autoscale(tight=True)\n>>> # draw a slightly opaque, dashed grid\n>>> plt.grid(True, linestyle=\'-\', color=\'0.75\')\n>>> plt.show()', ""[ 27 ]\nIt seems that we finally have a clear winner: The model with degree 2 has the lowest \ntest error, which is the error when measured using data that the model did not see \nduring training. And this gives us hope that we won't get bad surprises when future \ndata arrives.\nAnswering our initial question\nFinally we have arrived at a model which we think represents the underlying  \nprocess best; it is now a simple task of finding out when our infrastructure will  \nreach 100,000 requests per hour. We have to calculate when our model function \nreaches the value 100,000.\nHaving a polynomial of degree 2, we could simply compute the inverse of the \nfunction and calculate its value at 100,000. Of course, we would like to have an \napproach that is applicable to any model function easily.\nThis can be done by subtracting 100,000 from the polynomial, which results in \nanother polynomial, and finding its root. SciPy's \noptimize module has the function \nfsolve that achieves this, when providing an initial starting position with parameter \nx0. As every entry in our input data file corresponds to one hour, and we have 743 of""]","The errors for the polynomial degrees when fitting the web traffic data are as follows:

- Error for degree 3: 139,350,144.031725
- Error for degree 10: 121,942,326.363461
- Error for degree 53: 109,318,004.475556

These values indicate the performance of the models with different polynomial complexities.","The errors for increasing polynomial degrees are: degree 3 has error 139,350,144.032, degree 10 has error 121,942,326.869, and degree 50 has error 109,504,587.153. While higher degree polynomials have lower training errors, they overfit the data. The degree 2 polynomial with error 179,983,507.878 provides a better balance between fitting the data and generalizing to future data.",1.0,0.9377735379206881,0.49999999995,0.6666666666666666
